{
  "id": "sc1-n3-l1",
  "nodeId": "sc1-n3",
  "blockId": "SC1",
  "order": 1,
  "version": 1,
  "title": "Найти на схеме",
  "estimatedMinutes": 13,
  "keyTakeaway": "Единая точка отказа находится вопросом «а если его нет» по каждому элементу схемы, и решение о резервировании принимается по стоимости простоя для продукта.",
  "sections": [
    {
      "kind": "question",
      "blocks": [
        {
          "type": "paragraph",
          "text": "Как посмотреть на архитектурную схему и назвать три места, отказ которых остановит продукт?"
        }
      ]
    },
    {
      "kind": "cost",
      "blocks": [
        {
          "type": "paragraph",
          "text": "[[single-point-of-failure|Единая точка отказа]] обнаруживается либо на бумаге за полчаса, либо в проде за несколько часов простоя. Разница в стоимости — тысячекратная. Это одно из немногих упражнений, где продакт может дать команде реальную пользу без технических знаний."
        }
      ]
    },
    {
      "kind": "substance",
      "blocks": [
        {
          "type": "paragraph",
          "text": "Приём простой: **по каждому элементу схемы спросить «а если его нет?»** Если ответ «продукт не работает» — это единая точка отказа."
        },
        {
          "type": "paragraph",
          "text": "Типичные места:"
        },
        {
          "type": "paragraph",
          "text": "*База данных на запись.* Одна, реплики только читают. Отказ — продукт в режиме чтения. *Сервис авторизации.* Не работает — не работает ничего, потому что каждый запрос проверяет токен. *Внешний провайдер без плана Б.* Разбирался в `IN1-N5`. *Компонент, через который проходит весь трафик* — балансировщик, шлюз. *Общая очередь* — если через неё идёт всё."
        },
        {
          "type": "paragraph",
          "text": "Лечение — **[[redundancy|резервирование]]**: второй экземпляр, который подхватывает. Но не всё резервируется одинаково дёшево, и не всё нужно."
        },
        {
          "type": "paragraph",
          "text": "Продуктовый критерий: **что именно перестаёт работать и сколько это стоит?** Отказ сервиса рекомендаций — главный экран без персонализации, потеря небольшая. Отказ сервиса заказов — остановка выручки."
        },
        {
          "type": "paragraph",
          "text": "Отсюда таблица, которую стоит держать явно: компонент, что ломается для пользователя, стоимость часа простоя, есть ли резерв. Она делается за час и меняет разговор о надёжности с абстрактного на конкретный."
        }
      ]
    },
    {
      "kind": "example",
      "blocks": [
        {
          "type": "paragraph",
          "text": "Разбор дал шесть точек, из которых три оказались неочевидными."
        },
        {
          "type": "paragraph",
          "text": "*База на запись.* Известная, резерв — автоматическое переключение на реплику, до 2 минут недоступности записи. *Шлюз API.* Известная, три экземпляра. *Сервис авторизации.* Неочевидная: он маленький и о нём не думали. Каждый запрос ходит в него за проверкой токена. Отказ — полная остановка. Добавили кэш проверок на 60 секунд, теперь отказ на минуту незаметен. *Единственный экземпляр обработчика очереди заказов.* Неочевидная: обработчик один, при его падении заказы копятся и не уходят магазинам. Обнаружили именно этим упражнением. *Платёжный провайдер.* План Б — оплата при получении. *DNS-провайдер.* Классика, о которой не думает никто, пока не случится."
        },
        {
          "type": "paragraph",
          "text": "Час работы со схемой дал две реальные находки, каждая из которых однажды стоила бы нескольких часов простоя."
        }
      ]
    },
    {
      "kind": "limits",
      "blocks": [
        {
          "type": "paragraph",
          "text": "Резервировать всё дороже, чем терпеть часть отказов. Решение принимается по стоимости простоя, а не по принципу."
        }
      ]
    },
    {
      "kind": "takeaway",
      "blocks": [
        {
          "type": "paragraph",
          "text": "Единая точка отказа находится вопросом «а если его нет» по каждому элементу схемы, и решение о резервировании принимается по стоимости простоя для продукта."
        }
      ]
    }
  ],
  "termIds": [
    "single-point-of-failure",
    "redundancy"
  ],
  "diagramIds": [],
  "exerciseId": null,
  "crossRefs": []
}
