{
  "id": "se2-n3-l1",
  "nodeId": "se2-n3",
  "blockId": "SE2",
  "order": 1,
  "version": 1,
  "title": "Не собирать — тоже решение",
  "estimatedMinutes": 13,
  "keyTakeaway": "Каждое поле — обязательство, а не актив, и аудит полей обычно показывает, что треть из них не используется ни одной функцией.",
  "sections": [
    {
      "kind": "question",
      "blocks": [
        {
          "type": "paragraph",
          "text": "Поле «дата рождения» в профиле. Нужно ли оно?"
        }
      ]
    },
    {
      "kind": "cost",
      "blocks": [
        {
          "type": "paragraph",
          "text": "Данные воспринимаются как бесплатный актив: собрали на всякий случай, вдруг пригодится. На деле каждое поле — обязательство: хранить, защищать, удалять по запросу, объяснять регулятору. Половина полей в типичном продукте не используется никогда."
        }
      ]
    },
    {
      "kind": "substance",
      "blocks": [
        {
          "type": "paragraph",
          "text": "**[[data-minimisation|Минимизация данных]]** — собирать и хранить только необходимое для заявленной цели. Это одновременно юридическое требование в большинстве юрисдикций и практический принцип снижения риска."
        },
        {
          "type": "paragraph",
          "text": "Четыре вопроса перед добавлением поля:"
        },
        {
          "type": "paragraph",
          "text": "**Для чего конкретно?** Не «для персонализации», а «чтобы поздравлять с днём рождения». Если конкретной цели нет — поля нет."
        },
        {
          "type": "paragraph",
          "text": "**Можно ли обойтись менее точным?** Год рождения вместо даты. Город вместо адреса. Возрастная группа вместо возраста. Обычно можно, и риск падает существенно."
        },
        {
          "type": "paragraph",
          "text": "**Можно ли вычислить вместо хранения?** Возраст вычисляется из года. Категория покупателя — из истории."
        },
        {
          "type": "paragraph",
          "text": "**Что будет, если этого поля не будет?** Часто ничего."
        },
        {
          "type": "paragraph",
          "text": "**[[purpose-limitation|Ограничение цели]]** — второй принцип: данные, собранные для одной цели, не используются для другой без нового основания. Адрес, собранный для доставки, не может стать основой рекламного таргетинга."
        },
        {
          "type": "paragraph",
          "text": "Отдельно про **точность геолокации**: разница между городом, районом и точкой на карте — это разница между обычными и чувствительными данными. Точная траектория человека раскрывает место жительства, работы, привычки."
        },
        {
          "type": "paragraph",
          "text": "Практический приём — **аудит полей**: пройти по всем хранимым полям и для каждого назвать использующую его функцию. Поля без функции удаляются."
        }
      ]
    },
    {
      "kind": "example",
      "blocks": [
        {
          "type": "paragraph",
          "text": "Аудит полей профиля дал результат, типичный для продуктов такого возраста:"
        },
        {
          "type": "table",
          "header": [
            "Поле",
            "Использование",
            "Решение"
          ],
          "rows": [
            [
              "Дата рождения",
              "Нет",
              "Удалено"
            ],
            [
              "Пол",
              "Нет",
              "Удалено"
            ],
            [
              "Email",
              "Рассылки",
              "Оставлено, но необязательное"
            ],
            [
              "Полный адрес",
              "Доставка",
              "Оставлено"
            ],
            [
              "Точные координаты точки доставки",
              "Курьер",
              "Оставлено, срок хранения 30 дней после доставки"
            ],
            [
              "Место работы",
              "Нет",
              "Удалено"
            ],
            [
              "Второй телефон",
              "Нет",
              "Удалено"
            ]
          ]
        },
        {
          "type": "paragraph",
          "text": "Четыре поля из семи удалены. Ни одна функция не пострадала — они собирались «на будущее», которое не наступило."
        },
        {
          "type": "paragraph",
          "text": "Точные координаты — отдельное решение: они нужны курьеру в момент доставки и не нужны после. Срок хранения 30 дней вместо бессрочного."
        },
        {
          "type": "paragraph",
          "text": "Геолокация при выборе магазина: сначала запрашивали точное положение, потом — только для определения ближайших магазинов, с округлением до района при сохранении. Точность выбора не изменилась, чувствительность данных упала."
        }
      ]
    },
    {
      "kind": "limits",
      "blocks": [
        {
          "type": "paragraph",
          "text": "Минимизация конфликтует с аналитикой и машинным обучением, которым данные полезны. Разрешается через агрегацию и обезличивание — следующий узел."
        }
      ]
    },
    {
      "kind": "takeaway",
      "blocks": [
        {
          "type": "paragraph",
          "text": "Каждое поле — обязательство, а не актив, и аудит полей обычно показывает, что треть из них не используется ни одной функцией."
        }
      ]
    }
  ],
  "termIds": [
    "data-minimisation",
    "purpose-limitation"
  ],
  "diagramIds": [],
  "exerciseId": null,
  "crossRefs": []
}
