{
  "id": "v1-user-story",
  "nodeId": "v1-formalizaciya-scenariev-ispolzovaniya",
  "blockId": "V1",
  "order": 1,
  "version": 1,
  "title": "История пользователя: вся ценность в части «чтобы»",
  "estimatedMinutes": 4,
  "keyTakeaway": "Ценность формулировки — в окончании «чтобы». Если его нельзя дописать честно, вы описываете функцию, а не задачу, и проверить результат будет нечем.",
  "checkQuestion": "«Как логист, я хочу кнопку экспорта в Excel, чтобы был экспорт в Excel». Что здесь не так?",
  "blocks": [
    {
      "type": "paragraph",
      "text": "Ключевой вопрос узла: **какие задачи будут решать потребители?** Между «нужен фильтр по машинам» и «нужно за минуту понять, кто свободен в четверг» — пропасть. Первое можно сделать буквально и промахнуться."
    },
    {
      "type": "paragraph",
      "text": "**Что происходит, если на вопрос не отвечать.** Команда делает экраны, а не задачи. Каждый экран по отдельности соответствует просьбе, а вместе они не складываются в работу, которую человек приходил сделать."
    },
    {
      "type": "model_card",
      "title": "User Story",
      "subtitle": "Как <роль>, я хочу <действие>, чтобы <результат>",
      "items": [
        "**Роль** — не должность, а человек в конкретной ситуации.",
        "**Действие** — то, что он делает, а не элемент интерфейса.",
        "**Чтобы** — зачем; это единственная часть, которую можно проверить после релиза.",
        "История — не документ, а **обещание разговора**. Она напоминает поговорить, а не заменяет разговор."
      ]
    },
    {
      "type": "list",
      "items": [
        "«Как логист, я хочу кнопку фильтра» → «Как логист, я хочу видеть свободные машины на выбранную дату, чтобы не звонить водителям по очереди»",
        "«Как бухгалтер, я хочу выгрузку» → «Как бухгалтер, я хочу получать часы по каждому водителю за месяц, чтобы не сводить их вручную»",
        "«Как директор, я хочу дашборд» → «Как директор, я хочу раз в неделю видеть простой машин, чтобы решать, нужна ли ещё одна единица техники»"
      ]
    },
    {
      "type": "paragraph",
      "text": "Обратите внимание, что после переформулировки у каждой истории появляется **способ проверки**: число звонков, время сведения часов, решение о покупке. У формулировок с кнопкой и дашбордом такого способа нет."
    },
    {
      "type": "example",
      "title": "«Диспетчер», где Use Case всё-таки нужен",
      "text": "История «как логист, я хочу переназначить рейс, чтобы закрыть отказ водителя» выглядит простой ровно до первого вопроса: а если у нового водителя не хватает часов по режиму труда? А если машина другого класса? А если груз уже загружен?\n\nЗдесь нужен Use Case — последовательность шагов с явными альтернативами и исключениями. Правило простое: **история описывает намерение, use case описывает ветвление**. Как только ветвлений больше двух и они дорого стоят, истории перестаёт хватать."
    },
    {
      "type": "callout",
      "tone": "limit",
      "title": "Границы модели",
      "text": "Шаблон не делает историю хорошей. «Как пользователь, я хочу пользоваться системой, чтобы решать задачи» формально верен и бесполезен. И не описывайте историями всё подряд: настройка прав, миграция данных, интеграция — это работа, у которой нет пользовательского намерения, и притворяться, что есть, вредно."
    }
  ]
}
