{
  "id": "in3-n2-l2",
  "nodeId": "in3-n2",
  "blockId": "IN3",
  "order": 2,
  "version": 1,
  "title": "Что события делают с аналитикой",
  "estimatedMinutes": 13,
  "keyTakeaway": "Технические события точны и показывают только успешные исходы, поэтому продуктовое поведение измеряется отдельно, а структура технического события не должна диктоваться потребностями отчёта.",
  "sections": [
    {
      "kind": "question",
      "blocks": [
        {
          "type": "paragraph",
          "text": "Если система и так публикует события о каждом действии, зачем отдельная продуктовая аналитика?"
        }
      ]
    },
    {
      "kind": "cost",
      "blocks": [
        {
          "type": "paragraph",
          "text": "Соблазн использовать технические события как продуктовые велик: они уже есть, они точны, они не требуют работы клиента. Продукты, поддавшиеся ему, обнаруживают через год, что метрики нельзя изменить, не затронув работу системы, и что половина продуктовых вопросов не имеет ответа."
        }
      ]
    },
    {
      "kind": "substance",
      "blocks": [
        {
          "type": "paragraph",
          "text": "Технические и продуктовые события отвечают на разные вопросы."
        },
        {
          "type": "paragraph",
          "text": "*Техническое событие* — что произошло в системе: `order.created`, `payment.confirmed`. Точно, надёжно, приходит с сервера, не зависит от клиента."
        },
        {
          "type": "paragraph",
          "text": "*Продуктовое событие* — что сделал человек: открыл экран, промотал ленту, отменил на середине, ушёл не завершив. Большая часть этого **не оставляет следа в системе вообще**, потому что ничего не изменила."
        },
        {
          "type": "paragraph",
          "text": "Отсюда главное ограничение: **по техническим событиям видно только то, что получилось.** Заказы, которые оформили. Не видно отвалов, сомнений, попыток, возвратов назад — то есть ровно того, что интересует продакта."
        },
        {
          "type": "paragraph",
          "text": "Что стоит брать из технических событий: факты, где важна точность и где расхождение недопустимо. Число заказов, суммы, статусы. Это надёжнее клиентской аналитики, которая теряет данные из-за сети и блокировщиков."
        },
        {
          "type": "paragraph",
          "text": "Что не стоит: поведение. Оно измеряется на клиенте."
        },
        {
          "type": "paragraph",
          "text": "Два практических правила:"
        },
        {
          "type": "paragraph",
          "text": "*Не менять техническое событие ради аналитики.* Как только структура события начинает диктоваться отчётом, изменение отчёта становится изменением системы. *Сверять одно другим.* Число `order.created` против числа продуктовых событий оформления — та самая сверка из `DS3-N4-L2`, которая ловит потерю событий в мобильном приложении."
        }
      ]
    },
    {
      "kind": "example",
      "blocks": [
        {
          "type": "paragraph",
          "text": "Разделение зафиксировали явно."
        },
        {
          "type": "paragraph",
          "text": "*Из технических событий:* заказы, выручка, статусы, отмены, начисления. Всё, что попадает в отчёты партнёрам и в финансы."
        },
        {
          "type": "paragraph",
          "text": "*Из клиентской аналитики:* воронка оформления, отвалы, использование фильтров, глубина просмотра каталога."
        },
        {
          "type": "paragraph",
          "text": "Случай, определивший правило: маркетинг попросил добавить в `order.created` источник трафика, чтобы считать конверсию по каналам. Отказали — событие описывает заказ, а не путь пользователя к нему. Источник трафика уехал в клиентскую аналитику и связывается с заказом по идентификатору."
        },
        {
          "type": "paragraph",
          "text": "Через полгода источники трафика перестраивали трижды. Каждая перестройка была бы изменением структуры события, на которое подписаны девять обработчиков."
        }
      ]
    },
    {
      "kind": "limits",
      "blocks": [
        {
          "type": "paragraph",
          "text": "Для небольшого продукта разделение избыточно: пока событий десяток, ими можно закрывать и то и другое. Разделять стоит, когда у событий появляется больше двух подписчиков."
        }
      ]
    },
    {
      "kind": "takeaway",
      "blocks": [
        {
          "type": "paragraph",
          "text": "Технические события точны и показывают только успешные исходы, поэтому продуктовое поведение измеряется отдельно, а структура технического события не должна диктоваться потребностями отчёта."
        }
      ]
    }
  ],
  "termIds": [],
  "diagramIds": [],
  "exerciseId": null,
  "crossRefs": []
}
