{
  "id": "g1-idea-generation",
  "nodeId": "g1-generaciya-i-upravlenie-ideyami",
  "blockId": "G1",
  "order": 1,
  "version": 1,
  "title": "Идеи не приходят — их перебирают",
  "estimatedMinutes": 4,
  "keyTakeaway": "Хорошая идея почти никогда не первая. Систематический перебор изменений существующего решения даёт больше пригодных вариантов, чем попытка придумать что-то новое с нуля.",
  "checkQuestion": "Команда за десять минут придумала три идеи и взялась за первую. Что здесь риск?",
  "blocks": [
    {
      "type": "paragraph",
      "text": "Ключевой вопрос узла: **как получить новую качественную идею?** «Качественную» здесь значит пригодную к проверке, а не красивую."
    },
    {
      "type": "paragraph",
      "text": "«Ветка» — вымышленное приложение для чтения книг по подписке: 400 тысяч активных пользователей в месяц, подписка после семи дней бесплатного доступа. Мы будем возвращаться к нему во всех уроках этого домена."
    },
    {
      "type": "paragraph",
      "text": "**Что происходит, если на вопрос не отвечать.** Обсуждение сводится к «давайте подумаем», кто-то называет первое, что приходит в голову, и дальше все обсуждают именно это. Первая названная идея становится единственной рассматриваемой не потому, что она лучшая."
    },
    {
      "type": "model_card",
      "title": "SCAMPER",
      "subtitle": "Семь операций над тем, что уже есть",
      "items": [
        "**Substitute** — заменить элемент: другой формат, другой канал, другой платящий.",
        "**Combine** — соединить с чем-то: две функции в одну, продукт с чужим продуктом.",
        "**Adapt** — перенести решение из другой области.",
        "**Modify** — усилить или ослабить: сделать намного больше, намного меньше, намного быстрее.",
        "**Put to another use** — то же самое для другой задачи или другого человека.",
        "**Eliminate** — убрать шаг, поле, экран, роль.",
        "**Reverse** — перевернуть порядок или роли: не пользователь ищет, а продукт предлагает."
      ]
    },
    {
      "type": "paragraph",
      "text": "Ценность SCAMPER не в оригинальности, а в **полноте перебора**: он заставляет пройти по операциям, которые сами по себе в голову не приходят. Особенно «убрать» — самая продуктивная и самая пропускаемая."
    },
    {
      "type": "example",
      "title": "«Ветка», семь дней бесплатного доступа",
      "text": "Задача: мало кто доходит до подписки. Первая идея на встрече — «увеличить пробный период до 14 дней».\n\nПрогнали через SCAMPER:\nУбрать — снять регистрацию до первой книги.\nЗаменить — вместо срока дать одну книгу целиком без ограничения по времени.\nПеревернуть — не пользователь ищет книгу, а продукт даёт первую готовую.\nИзменить — сократить пробный период до трёх дней, чтобы решение принималось, пока интерес есть.\n\nПоследняя идея противоположна первой, и обе правдоподобны. До перебора рассматривалась только одна."
    },
    {
      "type": "callout",
      "tone": "limit",
      "title": "Границы модели",
      "text": "Перебор даёт количество, а не качество: из двадцати вариантов девятнадцать будут негодными, и это нормально. SCAMPER работает над существующим решением и не помогает, когда нужно понять, ту ли задачу вы вообще решаете, — это вопрос дискавери, а не генерации."
    }
  ]
}
