{
  "id": "ds3-n1-l1",
  "nodeId": "ds3-n1",
  "blockId": "DS3",
  "order": 1,
  "version": 1,
  "title": "Двери, которые закрываются за спиной",
  "estimatedMinutes": 13,
  "keyTakeaway": "Внимание на обсуждении модели данных стоит тратить на решения, ошибка в которых означает безвозвратную потерю данных, а не объём работы.",
  "sections": [
    {
      "kind": "question",
      "blocks": [
        {
          "type": "paragraph",
          "text": "Команда обсуждает устройство данных для новой фичи полтора часа. Какие пятнадцать минут из них имели значение, а какие можно было пропустить?"
        }
      ]
    },
    {
      "kind": "cost",
      "blocks": [
        {
          "type": "paragraph",
          "text": "Продуктовые команды тратят внимание равномерно, а решения распределены крайне неравномерно. Большинство деталей модели данных переигрываются за день. Пять-шесть решений не переигрываются никогда — точнее, переигрываются ценой квартала работы и даунтайма. Продакт, не различающий эти два класса, спорит о названии поля и молча соглашается с кардинальностью связи."
        }
      ]
    },
    {
      "kind": "substance",
      "blocks": [
        {
          "type": "paragraph",
          "text": "[[reversible-decision|Обратимое решение]] можно отменить примерно за ту же цену, что и принять. [[one-way-door|Необратимое решение]] отменяется на порядок дороже."
        },
        {
          "type": "paragraph",
          "text": "В модели данных граница проходит довольно чётко."
        },
        {
          "type": "paragraph",
          "text": "**Обратимо** — почти всё, что касается отдельных атрибутов: добавить поле, сделать необязательное обязательным, поменять тип, добавить индекс, денормализовать ради скорости. Дни работы, риск управляем."
        },
        {
          "type": "paragraph",
          "text": "**Необратимо** — пять вещей:"
        },
        {
          "type": "paragraph",
          "text": "*Первичный ключ сущности, попавший наружу.* Ушёл в URL, чек, письмо, интеграцию с партнёром. Отозвать нельзя."
        },
        {
          "type": "paragraph",
          "text": "*Кардинальность связей ядра.* Один заказ — один пользователь. Превратить в «многие ко многим» означает переписать всё, что заказ читает."
        },
        {
          "type": "paragraph",
          "text": "*Единица изоляции клиента.* Тенант — это компания, филиал или пользователь? Смена уровня перестраивает всю систему прав."
        },
        {
          "type": "paragraph",
          "text": "*[[granularity|Гранулярность]] событий и фактов.* Записываем событие на заказ или на каждую позицию? Огрубить всегда можно, детализировать задним числом — нет: данных, которые не записали, не существует. Это самая тихая из необратимых ошибок, потому что она не ломает ничего сегодня."
        },
        {
          "type": "paragraph",
          "text": "*Ключ шардирования*, если система уже шардирована."
        },
        {
          "type": "paragraph",
          "text": "Практический приём: на обсуждении модели вслух назвать, какие из решений необратимы. Обычно их одно-два, и разговор мгновенно перестраивается вокруг них."
        }
      ]
    },
    {
      "kind": "example",
      "blocks": [
        {
          "type": "paragraph",
          "text": "Ретроспектива трёх решений."
        },
        {
          "type": "paragraph",
          "text": "*Артикул поставщика как ключ товара* — необратимое, принятое за десять минут как очевидное. Поставщик сменил систему артикулов, исправление стоило больше, чем вся экономия."
        },
        {
          "type": "paragraph",
          "text": "*Событие «заказ оформлен» без разбивки по позициям* — необратимое, и никто не заметил. Через год маркетинг попросил конверсию по категориям товаров. Данные есть только с момента, когда гранулярность поменяли, — год истории потерян навсегда."
        },
        {
          "type": "paragraph",
          "text": "*Хранение адреса строкой, а не структурой* — казалось необратимым, оказалось обратимым. Разбор строк на компоненты занял две недели фонового процесса, около 3% адресов пришлось уточнять у пользователей. Неприятно, но это не квартал."
        },
        {
          "type": "paragraph",
          "text": "Правило, которое команда вывела: **если ошибка означает потерю данных, которые нельзя восстановить, решение необратимо. Если она означает работу — обратимо, каким бы объёмным ни был этот труд.**"
        }
      ]
    },
    {
      "kind": "limits",
      "blocks": [
        {
          "type": "paragraph",
          "text": "Необратимость зависит от масштаба. На тысяче записей переигрывается всё. Список выше — для продукта, который уже накопил историю и имеет внешних потребителей данных."
        }
      ]
    },
    {
      "kind": "takeaway",
      "blocks": [
        {
          "type": "paragraph",
          "text": "Внимание на обсуждении модели данных стоит тратить на решения, ошибка в которых означает безвозвратную потерю данных, а не объём работы."
        }
      ]
    }
  ],
  "termIds": [
    "reversible-decision",
    "one-way-door",
    "granularity"
  ],
  "diagramIds": [],
  "exerciseId": null,
  "crossRefs": []
}
