{
  "id": "r2-migrations",
  "nodeId": "r2-podgotovka-migraciy",
  "blockId": "R2",
  "order": 5,
  "version": 1,
  "title": "Миграция: перевести людей, а не только данные",
  "estimatedMinutes": 6,
  "keyTakeaway": "Переход срывается не на данных, а на людях: старое привычно и надёжно, новое неизвестно. Работают три вещи — параллельная работа, обратимость и перенос того, что человек считает своим.",
  "checkQuestion": "Новая версия «Полки» лучше по всем метрикам, но 30 магазинов из 40 не переходят. Где искать причину?",
  "blocks": [
    {
      "type": "paragraph",
      "text": "Ключевой вопрос узла: **как перейти с одной версии на другую?**"
    },
    {
      "type": "paragraph",
      "text": "**Что происходит, если на вопрос не отвечать.** Дату переключения назначают исходя из готовности разработки. В день X половина пользователей не готова, поддержка перегружена, а откатиться нельзя, потому что данные уже переписаны."
    },
    {
      "type": "model_card",
      "title": "Четыре силы перехода",
      "subtitle": "Две толкают вперёд, две удерживают",
      "items": [
        "**Толчок от старого** — чем текущая версия плоха настолько, что терпеть нельзя.",
        "**Притяжение нового** — что человек получит. Обычно единственная сила, о которой думает команда.",
        "**Привычка** — стоимость переучивания и то, что старое уже работает.",
        "**Тревога** — что если новое подведёт в самый ответственный момент. Снимается обратимостью, а не уговорами."
      ]
    },
    {
      "type": "model_card",
      "title": "Как это делают на практике",
      "subtitle": "Порядок, который снижает цену ошибки",
      "items": [
        "**Параллельная работа** — период, когда доступны обе версии. Дорого, но это и есть плата за спокойный переход.",
        "**Волны** — сначала несколько лояльных, потом группа, потом все. Каждая волна даёт время починить найденное.",
        "**Перенос своего** — настройки, история, справочники. Человек не должен заводить всё заново.",
        "**Кнопка назад** — возможность вернуться на старую версию первые недели. Пользуются единицы, но знание, что она есть, снимает тревогу у всех.",
        "**Срок отключения старого** — объявляется заранее и один раз; переносы срока учат тому, что можно не торопиться."
      ]
    },
    {
      "type": "example",
      "title": "«Полка» 2.0, как прошло",
      "text": "Первая попытка: объявили дату, перевели всех, вернули 12 магазинов из 40 обратно через неделю — не нашли отчёт по расхождениям, к которому привыкли.\n\nВторая: три волны по две недели. В первой волне пять магазинов, где всплыло, что справочник поставщиков не переносится — люди завели бы его заново, а это два часа на магазин. Починили до второй волны.\n\nСтарую версию отключили через три месяца, о дате сказали в начале. Вернулись назад двое, оба потом перешли сами."
    },
    {
      "type": "callout",
      "tone": "warning",
      "title": "Данные переносят с проверкой, а не с надеждой",
      "text": "До переключения полезно прогнать сверку: одинаковое ли количество записей, совпадают ли суммы, что стало с пустыми полями. Расхождение, найденное после отключения старого, чинить уже нечем."
    },
    {
      "type": "callout",
      "tone": "limit",
      "title": "Границы модели",
      "text": "Параллельная работа стоит денег и удваивает поддержку. Это осознанная плата: если переход дешёвый и обратимый, её можно не платить — но решение должно быть принято, а не получиться само."
    }
  ]
}
