{
  "id": "d3-research-goals",
  "nodeId": "d3-opredelenie-celey-issledovaniya",
  "blockId": "D3",
  "order": 1,
  "version": 1,
  "title": "Исследование начинается с решения, которое от него зависит",
  "estimatedMinutes": 7,
  "keyTakeaway": "Полезное исследование привязано к решению: названо, что мы решаем, какие варианты рассматриваем и какой ответ сдвинет выбор. Исследование «чтобы лучше понимать пользователей» не заканчивается ничем и не заканчивается никогда.",
  "checkQuestion": "Команда просит «исследование удовлетворённости». Какие два вопроса вы зададите до старта?",
  "blocks": [
    {
      "type": "paragraph",
      "text": "Ключевой вопрос узла: **какие исследования нужны для целей компании?** В блоках D1 и D2 мы применяли отдельные методы; здесь речь о том, как выбирать между ними и как ставить исследованию задачу."
    },
    {
      "type": "paragraph",
      "text": "Сквозной пример: «Смена» — вымышленный сервис графиков смен для небольших кафе и магазинов. Компания выросла: теперь исследованиями занимаются трое, и вопрос «что изучать в следующем квартале» стал настоящим."
    },
    {
      "type": "paragraph",
      "text": "**Что происходит, если на вопрос не отвечать.** Исследования превращаются в поток отчётов, которые никто не открывает. Через год у компании есть библиотека знаний и ни одного решения, принятого на её основе."
    },
    {
      "type": "model_card",
      "title": "Постановка задачи на исследование",
      "subtitle": "Пять строк, без которых начинать не стоит",
      "items": [
        "**Решение** — что именно мы решим по результатам. Если ответ «ничего, просто узнаем», исследование не нужно.",
        "**Варианты** — между чем выбираем. Их должно быть минимум два, иначе решение уже принято.",
        "**Что сдвинет выбор** — какой результат склонит к какому варианту. Формулируется до сбора данных.",
        "**Срок и цена решения** — сколько времени есть и во что обойдётся ошибка. Дорогое и необратимое решение оправдывает дорогое исследование, дешёвое — нет.",
        "**Что уже известно** — прошлые исследования и данные. Половина запросов закрывается здесь."
      ]
    },
    {
      "type": "model_card",
      "title": "Какой метод под какой вопрос",
      "subtitle": "Метод следует из вопроса, а не наоборот",
      "items": [
        "**Почему так происходит** — интервью и наблюдение. Числа тут бесполезны.",
        "**Сколько людей и как часто** — данные продукта, опрос на большой выборке.",
        "**Что человек выберет** — эксперимент или наблюдение за поведением; спрашивать бесполезно.",
        "**Понятно ли** — юзабилити-тест на пяти-восьми людях. Больше не нужно: проблемы повторяются.",
        "**Стоит ли вообще делать** — часто дешевле имитировать функцию вручную, чем изучать намерение."
      ]
    },
    {
      "type": "example",
      "title": "«Смена», два запроса на исследование",
      "text": "Запрос 1: «Изучить удовлетворённость пользователей».\nВопросы: какое решение зависит? — «никакое, для понимания». Отклонено.\n\nЗапрос 2: «Понять, почему кафе с одной точкой уходят на третьем месяце».\nРешение: делать ли отдельный упрощённый тариф или улучшать текущий продукт.\nЧто сдвинет выбор: если уходят из-за цены — тариф; если из-за того, что график на одну точку проще вести в тетради, — тариф не поможет.\nМетод: 8 интервью с ушедшими плюс разрез оттока по числу точек.\nСрок: две недели. Цена ошибки: квартал разработки тарифа.\n\nВторое исследование заняло десять дней и отменило работу на квартал."
    },
    {
      "type": "callout",
      "tone": "warning",
      "title": "Исследование, которое не может изменить решение, — это ритуал",
      "text": "Если ответственный говорит «мы всё равно это сделаем, просто хотим подтвердить», честнее не тратить время. Такие исследования всегда «подтверждают» — вопрос лишь в том, какой кусок данных выберут."
    },
    {
      "type": "callout",
      "tone": "limit",
      "title": "Границы модели",
      "text": "Не всё нужно исследовать. Дешёвое и обратимое решение проще принять и посмотреть, чем изучать: стоимость исследования должна быть меньше стоимости ошибки, и это сравнение делается до начала."
    }
  ]
}
