{
  "id": "m1-case-study",
  "nodeId": "m1-formirovanie-case-study",
  "blockId": "M1",
  "order": 1,
  "version": 1,
  "title": "Кейс без числа — это отзыв",
  "estimatedMinutes": 4,
  "keyTakeaway": "Кейс отвечает на три вопроса: что было, что сделали, что изменилось — и третий обязательно числом. Без числа получается приятная история, которая ничего не доказывает.",
  "checkQuestion": "«Клиенту очень понравился сервис, работа стала удобнее». Что здесь не так?",
  "blocks": [
    {
      "type": "paragraph",
      "text": "Ключевой вопрос узла: **о каких результатах рассказать потребителям?** Кейс — это доказательство из урока про сообщение, только развёрнутое."
    },
    {
      "type": "paragraph",
      "text": "**Что происходит, если на вопрос не отвечать.** Появляется страница «Наши клиенты» с логотипами и цитатами вида «удобно и быстро». Читатель не может перенести это на себя, потому что не понимает, был ли клиент похож на него."
    },
    {
      "type": "model_card",
      "title": "Структура кейса",
      "subtitle": "Три части, и третья решает",
      "items": [
        "**Ситуация** — кто клиент и что у него не работало. Достаточно подробно, чтобы читатель узнал себя.",
        "**Что сделали** — не список функций, а как изменился процесс.",
        "**Результат** — число: было столько, стало столько, за такой срок.",
        "**Оговорка** — что ещё влияло. Честный кейс сильнее идеального: ему верят."
      ]
    },
    {
      "type": "example",
      "title": "«Реестр», кейс на 500 знаков",
      "text": "Ситуация: производственная компания на 12 человек, 60 актов в месяц, акт ходил по почте в среднем 4 дня, из-за этого закрытие месяца съезжало.\n\nЧто сделали: перевели подписание с контрагентами в браузер, начали с восьми самых частых контрагентов.\n\nРезультат: срок подписания 6 часов вместо 4 дней на этих восьми, закрытие месяца перестало съезжать. Замер за два месяца.\n\nОговорка: с остальными контрагентами срок не изменился — они пока не подключены.\n\nОговорка не ослабила кейс: именно она превратила его из рекламы в описание того, чего реально ждать."
    },
    {
      "type": "callout",
      "tone": "limit",
      "title": "Границы модели",
      "text": "Кейс убеждает похожих: производственная компания на 12 человек ничего не говорит сети на 400 сотрудников. Поэтому кейсов нужно несколько, по одному на сегмент, а не один самый красивый. И согласование с клиентом занимает недели — закладывайте это в сроки."
    }
  ]
}
