{
  "id": "ai2-n3-l1",
  "nodeId": "ai2-n3",
  "blockId": "AI2",
  "order": 1,
  "version": 1,
  "title": "Из чего складывается счёт",
  "estimatedMinutes": 13,
  "keyTakeaway": "Стоимость AI-функции определяется частотой вызова не меньше, чем ценой вызова, и главный рычаг — не считать то, что не зависит от пользователя, в момент запроса.",
  "sections": [
    {
      "kind": "question",
      "blocks": [
        {
          "type": "paragraph",
          "text": "Функция стоит 8 копеек за вызов. Много это или мало?"
        }
      ]
    },
    {
      "kind": "cost",
      "blocks": [
        {
          "type": "paragraph",
          "text": "AI-функции — единственная категория, где себестоимость может превысить ценность незаметно: стоимость за вызов мала, а вызовов много. Расчёт занимает десять минут и делается до разработки, а не после первого счёта."
        }
      ]
    },
    {
      "kind": "substance",
      "blocks": [
        {
          "type": "paragraph",
          "text": "Тарификация — [[price-per-1k-tokens|за токены]], отдельно вход и выход. Выход обычно дороже входа в 3–5 раз, но входа обычно больше, поэтому доминирует он."
        },
        {
          "type": "paragraph",
          "text": "Формула для одной функции:"
        },
        {
          "type": "code",
          "text": "стоимость вызова = вход × цена_входа + выход × цена_выхода\nгодовая стоимость = стоимость вызова × вызовов в день × 365"
        },
        {
          "type": "paragraph",
          "text": "Дополнительные статьи, о которых забывают:"
        },
        {
          "type": "paragraph",
          "text": "*Эмбеддинги.* И для индексации корпуса, и для каждого запроса. Индексация разовая, запросы постоянные. *Переранжирование.* Дополнительный вызов на каждый запрос. *Вспомогательные вызовы.* Переформулировка запроса, сжатие истории, классификация. Каждый — отдельная строка. *Повторы.* Неудачные вызовы и ретраи оплачиваются."
        },
        {
          "type": "paragraph",
          "text": "Шесть рычагов снижения, по убыванию отдачи:"
        },
        {
          "type": "paragraph",
          "text": "**Сократить вход.** Обычно самый крупный. Меньше найденных документов, короче инструкция, сжатая история. **[[prompt-caching|Кэширование промпта]].** Неизменная часть обрабатывается однажды. Может снизить стоимость входа существенно. **Кэшировать ответы.** Одинаковые вопросы о том же товаре встречаются постоянно. **[[routing|Маршрутизация]].** Простые запросы — дешёвой модели, сложные — дорогой. **Сократить выход.** Требовать краткости в инструкции. **Считать заранее.** Суммаризация отзывов не зависит от пользователя — считается фоном."
        },
        {
          "type": "paragraph",
          "text": "Последний рычаг самый недооценённый: **если результат не зависит от конкретного пользователя, он не должен считаться в момент запроса.**"
        }
      ]
    },
    {
      "kind": "example",
      "blocks": [
        {
          "type": "paragraph",
          "text": "Расчёт трёх функций до оптимизации:"
        },
        {
          "type": "table",
          "header": [
            "Функция",
            "Вызовов/сут",
            "Стоимость вызова",
            "В год"
          ],
          "rows": [
            [
              "Ответ о товаре",
              "1 400",
              "2.1 коп.",
              "107 тыс. ₽"
            ],
            [
              "Подбор корзины",
              "900",
              "18 коп.",
              "591 тыс. ₽"
            ],
            [
              "Суммаризация отзывов",
              "12 000",
              "4.8 коп.",
              "2.1 млн ₽"
            ]
          ]
        },
        {
          "type": "paragraph",
          "text": "Суммаризация оказалась дороже всего, хотя выглядела самой простой: она вызывалась при каждом открытии карточки товара."
        },
        {
          "type": "paragraph",
          "text": "Оптимизация: суммаризация считается один раз на товар и пересчитывается при накоплении 10 новых отзывов. Вызовов стало 300 в сутки вместо 12 000. Стоимость упала с 2.1 млн до 53 тысяч в год."
        },
        {
          "type": "paragraph",
          "text": "Подбор корзины: сокращение каталога в контексте с 12 400 до 3 500 токенов плюс кэширование промпта — с 18 до 5 копеек, 591 тыс. → 164 тыс."
        },
        {
          "type": "paragraph",
          "text": "Суммарная экономия — около 2.5 млн в год, при том что все три функции остались."
        }
      ]
    },
    {
      "kind": "limits",
      "blocks": [
        {
          "type": "paragraph",
          "text": "Цены моделей падают быстро, и расчёт годичной давности может быть неактуален. Пересчитывать стоит при каждом пересмотре, но структура рычагов устойчива."
        }
      ]
    },
    {
      "kind": "takeaway",
      "blocks": [
        {
          "type": "paragraph",
          "text": "Стоимость AI-функции определяется частотой вызова не меньше, чем ценой вызова, и главный рычаг — не считать то, что не зависит от пользователя, в момент запроса."
        }
      ]
    }
  ],
  "termIds": [
    "price-per-1k-tokens",
    "prompt-caching",
    "routing"
  ],
  "diagramIds": [],
  "exerciseId": null,
  "crossRefs": []
}
